{
  "version": "1.0",
  "description": "Test fixtures for Lutron CCA packet parsing verification",
  "packets": [
    {
      "id": "btn_on_press_short_a",
      "name": "5-Button Pico ON Press (SHORT_A)",
      "category": "button",
      "raw_bytes": "88 00 8D E6 95 05 21 04 03 00 02 00 CC CC CC CC CC CC CC CC CC CC",
      "notes": "Button packets store device ID as little-endian (reversed from printed label). To get display ID, read bytes [2-5] as little-endian. CRC omitted - will be computed.",
      "expected": {
        "packet_type": "BTN_SHORT_A",
        "packet_type_byte": "0x88",
        "sequence": 0,
        "device_id": "0595E68D",
        "device_id_endian": "little",
        "button": "ON",
        "button_code": "0x02",
        "action": "PRESS",
        "action_code": "0x00"
      },
      "field_bytes": {
        "type": {"offset": 0, "bytes": "88"},
        "sequence": {"offset": 1, "bytes": "00"},
        "device_id": {"offset": 2, "bytes": "8D E6 95 05", "note": "Stored reversed, displayed as 0595E68D"},
        "button": {"offset": 10, "bytes": "02"},
        "action": {"offset": 11, "bytes": "00"}
      }
    },
    {
      "id": "state_rpt_44pct",
      "name": "Dimmer State Report at 44%",
      "category": "state_report",
      "raw_bytes": "81 01 AD 90 2C 00 21 09 00 07 01 6F CE FE 02 02 00 CC CC CC CC CC E3 CC",
      "notes": "STATE_RPT uses little-endian device ID. Bytes [2-5] = AD 90 2C 00 -> displayed as 002C90AD. From real_unpair_working.log capture.",
      "expected": {
        "packet_type": "STATE_RPT",
        "packet_type_byte": "0x81",
        "sequence": 1,
        "device_id": "002C90AD",
        "device_id_endian": "little",
        "level": 44,
        "crc_valid": true
      },
      "field_bytes": {
        "type": {"offset": 0, "bytes": "81"},
        "sequence": {"offset": 1, "bytes": "01"},
        "device_id": {"offset": 2, "bytes": "AD 90 2C 00", "note": "Little-endian: read as 002C90AD"},
        "format": {"offset": 7, "bytes": "09"},
        "level_byte": {"offset": 11, "bytes": "6F", "note": "0x6F = 111 -> 111/254 * 100 = 43.7% ~ 44%"}
      }
    },
    {
      "id": "state_rpt_100pct",
      "name": "Dimmer State Report at 100%",
      "category": "state_report",
      "raw_bytes": "82 01 AD 90 2C 00 21 0C 00 FF FF FF FF FF 02 08 07 01 6F CE CC CC 95 DB",
      "notes": "Wait - this is actually an UNPAIR packet! Format byte 0x0C at [7] distinguishes from STATE_RPT. From dual_unpair_test.log.",
      "expected": {
        "packet_type": "UNPAIR",
        "packet_type_byte": "0x82",
        "sequence": 1,
        "device_id": "07016FCE",
        "source_id": "002C90AD",
        "source_id_endian": "little",
        "target_id": "07016FCE",
        "target_id_endian": "big",
        "crc_valid": true
      },
      "field_bytes": {
        "type": {"offset": 0, "bytes": "82"},
        "sequence": {"offset": 1, "bytes": "01"},
        "source_id": {"offset": 2, "bytes": "AD 90 2C 00", "note": "Bridge zone, little-endian: 002C90AD"},
        "format": {"offset": 7, "bytes": "0C", "note": "0x0C = UNPAIR (vs 0x0E = LEVEL)"},
        "broadcast": {"offset": 9, "bytes": "FF FF FF FF FF"},
        "cmd": {"offset": 14, "bytes": "02 08", "note": "Unpair command bytes"},
        "target_id": {"offset": 16, "bytes": "07 01 6F CE", "note": "Target device, big-endian: 07016FCE"}
      }
    },
    {
      "id": "unpair_phase1_prepare",
      "name": "Unpair Phase 1 - Prepare Packet",
      "category": "unpair_prepare",
      "raw_bytes": "81 01 AD 90 2C 00 21 09 00 07 01 6F CE FE 02 02 00 CC CC CC CC CC E3 CC",
      "notes": "Phase 1 of unpair uses format 0x09 and cmd 02 02. This prepares the target device. From real_unpair_working.log.",
      "expected": {
        "packet_type": "UNPAIR_PREPARE",
        "packet_type_byte": "0x81",
        "sequence": 1,
        "source_id": "002C90AD",
        "target_id": "07016FCE",
        "format_byte": "0x09",
        "cmd_bytes": "02 02",
        "crc_valid": true
      },
      "field_bytes": {
        "type": {"offset": 0, "bytes": "81"},
        "sequence": {"offset": 1, "bytes": "01"},
        "source_id": {"offset": 2, "bytes": "AD 90 2C 00"},
        "format": {"offset": 7, "bytes": "09"},
        "target_id": {"offset": 9, "bytes": "07 01 6F CE"},
        "cmd": {"offset": 14, "bytes": "02 02"}
      }
    },
    {
      "id": "unpair_phase2_flood",
      "name": "Unpair Phase 2 - Flood Packet",
      "category": "unpair",
      "raw_bytes": "82 07 AF 90 2C 00 21 0C 00 FF FF FF FF FF 02 08 07 01 6F CE CC CC 56 27",
      "notes": "Phase 2 of unpair uses format 0x0C and cmd 02 08. Broadcast address (FFFFF) used. From dual_unpair_test.log.",
      "expected": {
        "packet_type": "UNPAIR",
        "packet_type_byte": "0x82",
        "sequence": 7,
        "source_id": "002C90AF",
        "target_id": "07016FCE",
        "format_byte": "0x0C",
        "cmd_bytes": "02 08",
        "crc_valid": true,
        "crc_hex": "5627"
      },
      "field_bytes": {
        "type": {"offset": 0, "bytes": "82"},
        "sequence": {"offset": 1, "bytes": "07"},
        "source_id": {"offset": 2, "bytes": "AF 90 2C 00", "note": "Little-endian: 002C90AF"},
        "format": {"offset": 7, "bytes": "0C"},
        "broadcast": {"offset": 9, "bytes": "FF FF FF FF FF"},
        "cmd": {"offset": 14, "bytes": "02 08"},
        "target_id": {"offset": 16, "bytes": "07 01 6F CE", "note": "Big-endian: 07016FCE"},
        "crc": {"offset": 22, "bytes": "56 27"}
      }
    },
    {
      "id": "level_cmd_example",
      "name": "Bridge Level Command",
      "category": "level",
      "raw_bytes": "82 05 AD 90 2C 00 21 0E 00 00 2C 90 AF FE 40 02 BE DF 00 00 00 00",
      "notes": "LEVEL command has format byte 0x0E at [7]. Source (bridge zone) is little-endian, target (device) at [9-12] is big-endian. CRC omitted.",
      "expected": {
        "packet_type": "LEVEL",
        "packet_type_byte": "0x82",
        "sequence": 5,
        "source_id": "002C90AD",
        "source_id_endian": "little",
        "target_id": "002C90AF",
        "target_id_endian": "big",
        "level": 75,
        "format_byte": "0x0E"
      },
      "field_bytes": {
        "type": {"offset": 0, "bytes": "82"},
        "sequence": {"offset": 1, "bytes": "05"},
        "source_id": {"offset": 2, "bytes": "AD 90 2C 00", "note": "Little-endian bridge zone"},
        "format": {"offset": 7, "bytes": "0E", "note": "0x0E = LEVEL command"},
        "target_id": {"offset": 9, "bytes": "00 2C 90 AF", "note": "Big-endian target device"},
        "level_16bit": {"offset": 16, "bytes": "BE DF", "note": "0xBEDF = 48863, (48863/65279)*100 = 74.8% ~ 75%"}
      }
    },
    {
      "id": "btn_scene_bright",
      "name": "Scene Pico BRIGHT Button",
      "category": "button",
      "raw_bytes": "88 00 BB 1E 4B 08 21 04 03 00 08 00 CC CC CC CC CC CC CC CC CC CC",
      "notes": "Scene Pico button press. Device ID 084B1EBB stored little-endian in bytes [2-5] as BB 1E 4B 08. Button 0x08 = BRIGHT (Scene 1).",
      "expected": {
        "packet_type": "BTN_SHORT_A",
        "packet_type_byte": "0x88",
        "sequence": 0,
        "device_id": "084B1EBB",
        "device_id_endian": "little",
        "button": "SCENE1",
        "button_code": "0x08",
        "action": "PRESS"
      },
      "field_bytes": {
        "type": {"offset": 0, "bytes": "88"},
        "sequence": {"offset": 1, "bytes": "00"},
        "device_id": {"offset": 2, "bytes": "08 4B 1E BB", "note": "Big-endian: 084B1EBB"},
        "button": {"offset": 10, "bytes": "08", "note": "0x08 = SCENE1/BRIGHT"},
        "action": {"offset": 11, "bytes": "00"}
      }
    }
  ],
  "button_codes": {
    "0x02": "ON",
    "0x03": "FAV",
    "0x04": "OFF",
    "0x05": "RAISE",
    "0x06": "LOWER",
    "0x08": "SCENE1",
    "0x09": "SCENE2",
    "0x0A": "SCENE3",
    "0x0B": "SCENE4"
  },
  "action_codes": {
    "0x00": "PRESS",
    "0x01": "RELEASE",
    "0x02": "SAVE"
  },
  "packet_types": {
    "0x88": "BTN_SHORT_A",
    "0x89": "BTN_LONG_A",
    "0x8A": "BTN_SHORT_B",
    "0x8B": "BTN_LONG_B",
    "0x81": "STATE_RPT_81",
    "0x82": "STATE_RPT_82",
    "0x83": "STATE_RPT_83",
    "0x91": "BEACON",
    "0xB8": "PAIRING_B8",
    "0xB9": "PAIRING_B9",
    "0xBA": "PAIRING_BA",
    "0xBB": "PAIRING_BB"
  },
  "endianness_rules": {
    "description": "All SOURCE device IDs are stored little-endian. Only TARGET IDs are big-endian.",
    "BTN_*": "Device ID (source) stored little-endian - read bytes reversed to get label",
    "STATE_RPT": "Device ID (source) stored little-endian - read bytes reversed to get label",
    "LEVEL": "Source ID stored little-endian, Target ID stored big-endian",
    "UNPAIR": "Bridge zone (source) stored little-endian, Target ID stored big-endian",
    "PAIRING": "Device ID (source) stored little-endian",
    "BEACON": "Load ID stored little-endian"
  },
  "format_byte_discrimination": {
    "description": "Byte[7] distinguishes packet subtypes for 0x81-0x83 packets",
    "0x08": "STATE_RPT (dimmer reporting its level)",
    "0x09": "UNPAIR_PREPARE (phase 1 of unpair)",
    "0x0C": "UNPAIR (phase 2 unpair flood)",
    "0x0E": "LEVEL (bridge setting device level)"
  }
}
